{
  "run_id": "2026-07-06-008",
  "app_name": "fixture-app",
  "created_at": "2026-07-06T09:00:00+09:00",
  "change_type": "spec_change",
  "change_description": "fixture 用の変更",
  "directly_changed_docs": [
    "05-features.md"
  ],
  "requirement_changes": [
    {
      "doc": "05-features.md",
      "section": "F-01 ログイン",
      "type": "modified",
      "dependency_category": "feature_flow",
      "summary": "ログイン方式の記述を更新",
      "impact_hint": ""
    }
  ]
}
